ID,Title,Location,Salary,Summary
https://kr.indeed.com/viewjob?jk=55584c627df1acaa,데이터 분석가/사이언티스트(신입/인턴 가능),쏘카 대한민국,,"Sheet) 등 데이터 분석 도구를 원활히 다루시거나, 앞으로 원활히 다루고자 하는 의지가 높으신 분 • Python, R 등의 프로그래밍 언어 혹은 데이터 분석 언어를 1개 이상 능숙하게 사용 가능하신 분 전형절차 서류..."
https://kr.indeed.com/viewjob?jk=e1ebfac18d00b273,[SK바이오사이언스] 21년 1분기 수시,에스케이바이오사이언스 성남 분당구,,"Office (excel, PPT 등) 활용 능력 - 우 대 1) SAP SD 모듈 활용 가능자 2) Python, R 등 다양한 data분석 tool 활용 가능자 마케팅PM - 직 무 1) 시장 분석 및 projection..."
https://kr.indeed.com/viewjob?jk=dfb20fa220f3c478,"빅데이터, 인공지능(AI) 외 신입/경력 인턴",스칼라웍스 대한민국,,인공지능)>인공지능(AI)|인터넷·IT·통신·모바일·게임>빅데이터·AI(인공지능)>데이터분석|인터넷·IT·통신·모바일·게임>빅데이터·AI(인공지능)> Python|인터넷·IT·통신·모바일·게임>빅데이터·AI(인공지능)>딥러닝
https://kr.indeed.com/viewjob?jk=afeaf9f2fdda7973,"Engr, Apps Dev 3",KLA-Tencor 대한민국,,"working effectively with different cultures. Matlab/ Python experience is a plus. We offer a competitive, family friendly..."
https://kr.indeed.com/viewjob?jk=818d5c4e3d4e8c76,디지털자산(암호화폐) 퀀트 트레이더 (경력),네오위즈 대한민국,,"경험이 있는 분 - 또는 운용사 및 증권회사에서 근무한 경력이 있는 분 우대사항 - 프로그래밍 능력( Python, R 등)을 보유하고, 개발해 본 경험이 있는 분 - 컴퓨터공학, 금융공학, 수학, 통계학을 전공한 분..."
https://kr.indeed.com/viewjob?jk=4bd70fb8a220d90d,[Janssen] Data Scientist,Johnson & Johnson Family of Companies 4.2 서울,,"Expertise in one or more programming languages... R, Python or SAS. 7. Knowledge of relational database architecture..."
https://kr.indeed.com/viewjob?jk=50a4d23577c58924,2021년 2분기 에이비엘생명보험 신입/경력/인턴 직원,ABL생명보험 서울 영등포구,,"해외여행 결격 사유가 없는 자 - 유사 업무 5년 이상 경력(통계분석 및 언더라이팅) [우대사항] - 프로그래밍( Python, DB SQL 등) - 디지털 기술(Machine learning/Bigdata/AI 등) - MS..."
https://kr.indeed.com/viewjob?jk=da5d4dd560fb6f85,Data Scientist,Garrett Advancing Motion 경기도,,"System/Data Integration • High level programming skills ( Python, R, Matlab, C++ or Java) • Machine Learning Algorithms..."
https://kr.indeed.com/viewjob?jk=89f3e10d77a126bf,Field Service Engineer,Nearfield Instruments 대한민국,,"troubleshooting. Preferably to have coding capability (Matlab, Python...etc... data analysis, visualization, and algorithm..."
https://kr.indeed.com/viewjob?jk=39e99c8ed1d40a8f,2021 토스 전 계열사 대규모,비바리퍼블리카 서울 강남구,,게임>빅데이터·AI(인공지능)> Python|인터넷·IT·통신·모바일·게임... 용프로그래머>Linux|인터넷·IT·통신·모바일·게임>응용프로그래머> Python|인터넷·IT·통신·모바일·게임>응용프로그래머>iOS|인터넷·IT·통신...
https://kr.indeed.com/viewjob?jk=3330430ae94277db,[타다]데이터 분석가/사이언티스트,쏘카 대한민국,,"통계에 대한 지식 및 머신러닝에 대한 지식을 보유하고 있으며, 데이터 분석 실무 경험이 풍부하신 분 • R, Python(Pandas, Numpy, Scikit-learn) 등의 데이터 분석을 위한 언어를 1개 이상 능숙하게..."
https://kr.indeed.com/viewjob?jk=a8de67022a7e45f2,자산·디지털 부문 경력사원 채용,삼성생명 4.1 서울 서초동,,"우대사항] -회사경력 7년↑(석사 5년↑) 또는 박사학위 보유 - Python기반 서비스 개발 경험 -IT(컴퓨팅, AI, ML 等)관련 학과 전공... 리에 대한 전문 지식 보유자 - Python, Tensorflow기반 딥러..."
https://kr.indeed.com/viewjob?jk=e46f381b4c6367f9,인공지능(AI) 프로그래밍 교육 소프트웨어 개발자,에이쳐 용인 처인구,,수 있습니다. 인터넷·IT·통신·모바일·게임>웹프로그래머>웹개발|인터넷·IT·통신·모바일·게임>웹프로그래머>백엔드|인터넷·IT·통신·모바일·게임>웹프로그래머>프론트엔드|인터넷·IT·통신·모바일·게임>웹프로그래머> Python
https://kr.indeed.com/viewjob?jk=750bd649ca4aec64,Operation Buyer(Contractor),Edwards Korea Ltd 충청남도 천안,,"programming languages or statistical software – ex) C++, Python, VBA, R, MATLAB, Minitab, SPC Start a journey towards..."
https://kr.indeed.com/viewjob?jk=e9ac1a8708b8e784,[상시 ] Data Scientist (대리급/과-차장급/정규직),라이나생명보험 서울 종로구,,"데이터 분석 프로젝트 수행 경험 3년 이상 3년 이상의 R, SQL, Python 등 프로그래밍 언어 활용 경험 최신 AI 관련 기술을 포함한 다양한... 수행 경험 7년 이상의 R, SQL, Python 등 프로그래밍 언어 활용..."
https://kr.indeed.com/viewjob?jk=4f2835fd73c9e3c7,Application Engineer III - (E3),Applied Materials Inc. 대한민국,,"trainer. 7. Direct experience of algorithm writing (e.g., R, Python... plus. 8. Travel to international locations at ~25..."
https://kr.indeed.com/viewjob?jk=b3891b8c405f34e6,Data Analytics 컨설턴트 - 글로벌 컨설팅Firm,에스에프인촌 서울,,본적으로 비즈니스 문제 해결이 가능한 컨설팅 자질을 갖추고 있어야 함 - Python 등 관련 코딩 경험자 우대 3) 영어 활용 능력 우수자 우대 4... 자질을 갖추고 있어야 함 - Python 등 관련 코딩 경험자 우대 3...
https://kr.indeed.com/viewjob?jk=9040dba1c8db2a5d,퀀트운용팀 (사원-대리급),신한비엔피파리바자산운용 대한민국,,지식 보유자 - 투자자산운용사 자격증 소지자 우대 - CFA/CAIA/CPA 자격증 소지자 우대 - VBA/ Python 활용한 업무 가능자 우대 - 관련 전공 및 석박사 학위/금융 관련 자격증 보유자 우대 3. 전형방법...
https://kr.indeed.com/viewjob?jk=5efc4afdac9d87aa,AI/딥러닝기반 머신비전 비전센터 상반기 공개,유토시스 경기도 화성,,"상처리응용S/W -. 딥러닝 모델링 [자격요건] -. 학력 : 대졸이상 -. MFC, C++, C# 또는 Python 경험자 -. 딥러닝 알고리즘 개발 경험자 -. 국내/외 출장 가능자 [우대사항] -. 수학/물리/통계/컴퓨..."
https://kr.indeed.com/viewjob?jk=094f2d843194ea1f,AppArmor Security Engineer,Canonical - Jobs 서울,,"grasp of Linux security technologies You are skilled in C, Python, and other programming languages You have experience..."
https://kr.indeed.com/viewjob?jk=78f5465432356e17,Sr Systems Administrator I,Raytheon Intelligence & Space 대한민국,,"Experience with Linux/Unix scripting, C++, Java, Perl, Python, Sybase... SQL. - Experience with Linux/Unix tools, YUM..."
https://kr.indeed.com/viewjob?jk=92a3c458d76803d2,[진행중]우리은행 마이데이터ACT 전문직 (데이터 사이언티스트(데이터 분...,우리은행 4.5 서울 회현동,,"이터 분석 업무 경력 5년 이상 보유자(관련 서비스 기획, 운영 경력 합산) - 데이터 분석 관련 언어( Python, R 등) 사용 능력 및 분석 결과의 실제 서비스 적용 경험 보유자 - 적극적이고 원만한 커뮤니케이션..."
https://kr.indeed.com/viewjob?jk=2054288dc83a5a88,[진행중]우리은행 AI사업부 전문직(인공지능(AI) 모델링) 채용공고,우리은행 4.5 서울 회현동,,"서비스 기획 경험자 - Tensorflow, Pytorch 등 머신러닝 도구 활용 역량 보유 - Python, R 등 프로그래밍 활용 역량 보유 - 은행, 카드, 보험 등 금융 분야 프로젝트 경험자 우대사항..."
https://kr.indeed.com/viewjob?jk=191afaf2b0f86c57,[빅데이터플랫폼] 데이터 플랫폼 운영자,한국카카오은행 성남 분당구,,"실무 경험이 있는 분 · 클라우드 및 가상화(Docker, Kubernetes) 사용 경험이 있는 분 · Python, Shell Script 로 개발 경험이 있는 분 [공통 우대 사항] · 국가유공자 및 장애인 등 취업보호..."
https://kr.indeed.com/viewjob?jk=d136d5b4d86f5c61,2021 업무혁신(PI) 신입사원,LG디스플레이 3.4 경기도 파주,,"유자 우대조건 - BI(Business Intelligence) Tool 활용능력 보유자 - 통계/분석(R, Python) Tool 활용능력 보유자 담당업무 - 공정 제어 PI (공정 변동 관리 업무) 필수조건 - 산업공학..."
https://kr.indeed.com/viewjob?jk=ee2cad5a4861601b,[이마트24] [Data Scientist] 경력사원 모집(Senior),신세계 4.5 대한민국,,"Data 분석 관련업무 최소 5년 이상(과장/대리급) - 통계/분석 관련업무 수행역량 보유자 - R, Python, SQL 등 통계/분석 프로그램 활용역량 및 Machine Learning/Deep Learning..."
https://kr.indeed.com/viewjob?jk=97b032faeb4b1bd1,연구소 개발부문 연구원 직원 (회로설계/하드웨어설계/머신비전/이미지프로세...,모든 경기도 광명,"연봉 42,000,000원 - 46,000,000원","프로그래밍 가능자 우대 S/W 설계 부문 : - OPEN CV, TENSORFLOW, YOLO, CUDA/ Python, C++, C WindowsGUL APL, MFC Lib 활용 가능자. 머신비전/ 영상처리 개발자 * 전기..."
https://kr.indeed.com/viewjob?jk=66d8a42fa933e7d0,2021년 상반기 정보보안 엔지니어 - 취약점파트,인섹시큐리티 서울 금천구,,10에 대한 설명과 구현/조치 가능 - 국내 컴플라이언스 대응 경험 (주요정보통신기반시설 가이드 등) - Python 활용자 - Kali 및 Metasploit 경험자 * 자격요건과 우대사항은 필수가 아닙니다. 0 명 근무조...
https://kr.indeed.com/viewjob?jk=9c4f4236ac42f224,DBA 엔지니어,쏘카 대한민국,,"시계열 데이터베이스(InfluxDB) 구축 운영 경험이 있으신 분 • 자동화를 위한 스크립트 (Shell, Python, Ansible) 지식을 보유하신 분 • 새로운 기술 도입에 대한 오픈 마인드를 가지고 계신 분 전형절차..."
https://kr.indeed.com/viewjob?jk=444320d2e49672dc,"Application Engineer South Korea (Physics, EE)",Zurich Instruments 대한민국,,"Experience in programming languages LabVIEW, MATLAB, Python or C is a plus. Availability to travel, around 25%. Moreover, we..."
https://kr.indeed.com/viewjob?jk=fc037709d0770796,System SW 엔지니어,딥엑스 성남 분당구,"연봉 40,000,000원 - 100,000,000원",사항: 대학교(4년)졸업 이상 [기본 요구능력] - ASM/C/C++/ Python 언어 코딩 기술 - 운영체제 SW 설계 및 구현 - 알고리즘/네트워... 게임>빅데이터·AI(인공지능)> Python|인터넷·IT·통신·모바일·게임...
https://kr.indeed.com/viewjob?jk=87309d3ff40ead61,딥러닝 AI 개발 연구원,베이리스 성남 수정구,,시스템프로그래머>임베디드(Embedded)|인터넷·IT·통신·모바일·게임>응용프로그래머>C·C++|인터넷·IT·통신·모바일·게임>응용프로그래머>Linux|인터넷·IT·통신·모바일·게임>빅데이터·AI(인공지능)> Python
https://kr.indeed.com/viewjob?jk=d4c52ba1a491a8b9,현대무벡스 경력사원 상시,현대무벡스 서울 종로구,,PM>웹기획|인터넷·IT·통신·모바일·게임>웹프로그래머>JAVA|인터넷·IT·통신·모바일·게임>웹프로그래머> Python|인터넷·IT·통신·모바일·게임>네트워크·서버·보안>정보보안|인터넷·IT·통신·모바일·게임>응용프로그래머>클라우드
https://kr.indeed.com/viewjob?jk=fb624a39a6824f57,2021 상반기 인공지능(AI)/ 머신러닝 경력사원,아프스 서울 서초구,,래밍 경력 2년 이상 -컴퓨터 공학 또는 관련학과 학사 이상 -팀러닝/컴퓨터 비전 관련 논문 독해 가능 - Python 및 1종 이상의 머신러닝 프레임워크 사용가능 [우대사항] 관련분야 실무경력 또는 석사학위 보유 OpenGL...
https://kr.indeed.com/viewjob?jk=7cb5c3076d1701db,"Field Applications Engineer, Audio",Dolby 서울,,"High level or detailed knowledge of SOC design. C/C++, python coding skills. Knowledge of music, audio/video production..."
https://kr.indeed.com/viewjob?jk=2695294aea6dc3b6,MongoDB Engineer 모집,카카오 4.0 성남 판교역,,수 있는 분 Linux/Network에 대한 기초 지식이 있는 분 우대 사항 C/C++ 또는 Python 언어를 이용한 프로그램 개발(프로젝트) 경험이 있는 분 MongoDB 트러블 슈팅 경험이 있는 분 MongoDB...
https://kr.indeed.com/viewjob?jk=2f9853d8068aa1f9,데이터 마트 개발,Nexon 성남 분당구,,등 데이터 파이프라인 구축에 대해 경험이 있으신 분 - SQL 활용 능력이 뛰어나신 분 우대사항 - Python이나 Scala 등과 같은 프로그래밍 언어를 활용하여 ETL 개발이 가능하신 분 - Spark를 활용하여...
https://kr.indeed.com/viewjob?jk=4e91309fc89e9534,2020년 하반기 영업/기획/마케팅/개발 부문,아우토크립트 서울 영등포구,,통신·모바일·게임>응용프로그래머> Python|인터넷·IT·통신·모바일·게임... 프로그래머> Python|인터넷·IT·통신·모바일·게임>웹프로그래머>JAVA|인터넷·IT·통신·모바일·게임>빅데이터·AI(인공지능)> Python|인터넷...
https://kr.indeed.com/viewjob?jk=a4b72e38fb50bde0,콘텐츠서비스개발- 데이터엔지니어,Nexon 성남 분당구,,및 운영 - 서비스 자동화 업무 지원자격 - 경력제한 없음 - Python 또는 NodeJS를 활용한 시스템 개발 경험 - Linux 기반의... 론트엔드 및 웹 개발 경험 - Python 또는 Scala를 활용한 데이...
https://kr.indeed.com/viewjob?jk=752a4b5d63eac97c,Back-end Engineer (Python),Soomgo 서울 강남구,,숨고의 백엔드 엔지니어( Python)는 숨고의 기반 기술을 담당하는 매우... 5년 이상의 웹/앱 서비스 백엔드 시스템 개발 경험이 있는 분 • Python 언어를 활용한 개발 경험이 있는 분 • 성능 최적화에 대해 지속적으로...
https://kr.indeed.com/viewjob?jk=92ec1289aa20da51,Internship for Green Growth Performance...,Global Green Growth Institute 서울,,models. Experience in applying programming software... R and Python is preferred. Excellent English communication skills...
https://kr.indeed.com/viewjob?jk=a6357089799f9975,Deep Learning R&D Engineer,Intel 4.1 서울,,"Caffe, and MxNet Strong programming skills with C/C++ and Python Experiences on programming and testing on Linux environment..."
https://kr.indeed.com/viewjob?jk=473f19e484779599,국내카드사 DW개발,제이엔커리어 서울 서초구,,"Presto 등 Hadoop Ecosystem의 이해 필요 - JAVA, Python 개발 경험자 - 프레임워크 외 오픈소스 도입 등의 유연한 사고... 의 이해 필요 - JAVA, Python 개발 경험자 - 프레임워크 외..."
https://kr.indeed.com/viewjob?jk=444320d2e49672dc,"Application Engineer South Korea (Physics, EE)",Zurich Instruments 대한민국,,"Experience in programming languages LabVIEW, MATLAB, Python or C is a plus. Availability to travel, around 25%. Moreover, we..."
https://kr.indeed.com/viewjob?jk=44a4245679066940,Data Science 컨설턴트 - 글로벌 컨설팅펌,에스에프인촌 서울 서초구,,"분석 등을 통한 Insight 도출 자격요건 통계학과/산업공학과/컴퓨터공학과 등 유관 학과 졸업/석박사 우대 Python 등 관련 코딩 경력 빅데이터, 통계, Machine Learning, 알고리즘 등 Artificial..."
https://kr.indeed.com/viewjob?jk=9ab2041ab3380a21,카카오톡 안티어뷰징을 위한 데이터/백엔드 엔지니어 및 머신러닝 전문가 모...,카카오 4.0 성남 판교역,,"Engineer, Data Scientist 해당 분야에서 활용되는 언어 및 도구를 능숙하게 다룰 수 있는 분( Python, Scala, PyMC, PySpark, Tensorflow 등) 우대 사항 컨테이너 환경에서의..."
https://kr.indeed.com/viewjob?jk=b40a553df450c1b4,[데이타게이트 코리아] IT지원 기술자/개발자,데이타게이트코리아 서울 구로구,,Platform 사용 경험자 ㆍApache OSS(Open Source Software) 사용 경험자 ㆍJava/ Python 개발 경험자 0 명 근무조건 고용형태: 정규직(수습기간3개월) 근무부서: 솔루션사업팀 인근전철역...
https://kr.indeed.com/viewjob?jk=9a691f4a11ff22c1,[TmaxCloud/기술] ProLinux QA,티맥스소프트 성남 분당구,,"사용 경험(RHEL, CentOS 등..) - ISTQB/CSTS 등 자격증 보유자 - 테스트 자동화용 Shell script 작성 경험자 - Python 사용 경험자 모집기간 2021/03/03 ~ 2021/03/31"
https://kr.indeed.com/viewjob?jk=96688eea9c1a9e28,Security Engineer (취약점 분석),Toss 서울 강남구,,"# 자격 요건 - 모의해킹 및 취약점 점검 경력이 있는 분 - 소스 코드 정적 취약점 점검에 능숙한 분 - Python, C, C++, JAVA 중 프로그래밍 언어에 능숙한 분 # 우대 사항 - 국내 또는 국외 버그 바운티..."
https://kr.indeed.com/viewjob?jk=ea3b136c0ff59524,데이터분석가(게임어뷰징 탐지),Nexon 성남 분당구,,"시스템 운영 등의 빅데이터 활용 업무경력) - 논리적이고 체계적인 문제 해결 및 커뮤니케이션 능력 - Python, Scala 등과 같은 프로그래밍언어로 데이터 분석 및 모델링 능력 (탐색적 데이터분석/ 데이터 전처리..."
https://kr.indeed.com/viewjob?jk=1b62babbbf2d717a,경험최적화 - 데이터 사이언티스트/분석가,Nexon 성남 분당구,,피처 탐색 등) - 게임 내 행동 패턴 로그 분석과 패턴 식별 및 이를 통한 서비스 개선 지원자격 - Python을 사용한 데이터 분석 및 모델 개발 경험 - 머신러닝 라이브러리 활용 경험 - 셀프 모티베이션과 원활한...
https://kr.indeed.com/viewjob?jk=f5b0e4923baeca2f,"MD, 플랫폼 개발자",슬래디티 경기도 의정부,,유통·물류·운송·운전>유통·상품기획·MD>상품MD|인터넷·IT·통신·모바일·게임>컨텐츠·사이트운영>웹사이트운영·테스터|인터넷·IT·통신·모바일·게임>웹프로그래머>JAVA|인터넷·IT·통신·모바일·게임>웹프로그래머> Python
https://kr.indeed.com/viewjob?jk=6a68f8486233d014,해양물리사업부 (조사 및 분석),선영종합엔지니어링 고양 덕양구,,"학력무관 [우대사항] ㆍ수치모델링 가능자 최우선 ㆍ관련분야 석사이상 ㆍ프로그래밍 (Fortran, C, Python, Matlab 등), AutoCAD, GIS 업무관련 프로그램 숙련자 ㆍ영어 능통자 0 명 근무조건 고용형태..."
https://kr.indeed.com/viewjob?jk=60d03da8a3724068,이공계 전문기술 연수사업 수강생,경기도경제과학진흥원 서울,,용프로그래머> Python|인터넷·IT·통신·모바일·게임>웹프로그래머>JAVA|인터넷·IT·통신·모바일·게임>웹프로그래머> Python|인터넷·IT·통신·모바일·게임>빅데이터·AI(인공지능)> Python|인터넷·IT·통신·모바일...
https://kr.indeed.com/viewjob?jk=98bcd93b1228e4b9,머신러닝 엔지니어,제이앤제이글로벌컨설팅 성남 분당구,,"요건 ㆍHadoop, Spark, Docker 등 빅데이터분석환경 경험 ㆍ Python 언어로 프로그래밍 가능 ㆍTensorflow, Pytorch... 게임>빅데이터·AI(인공지능)> Python|인터넷·IT·통신·모바일·게임..."
https://kr.indeed.com/viewjob?jk=8b950c3f1114b37b,[Clova CIC] AI/ML 개발자 (경력),네이버 서울,,"대한 기본 지식 - PyTorch나 Tensorflow와 같은 딥러닝 프레임워크에 대한 지식 및 개발 경험 - Python을 사용한 소프트웨어 개발 경험 우대사항 - 컴퓨터과학, 컴퓨터 엔지니어링, 수학 및 관련 분야 전공..."
https://kr.indeed.com/viewjob?jk=8ee4ab813459185c,AI 분석 개발 경력자,토니서치 성남 분당구,,"니어 - 데이터전처리,분석을통한 알고리즘선정및 fine tuning - python 으로 검증된 학습코드를 자체 빅데이터 분석플랫폼에 이식 [근무부서... 등 빅데이터분석환경 경험 - Python 언어로 프로그래밍 가능..."
https://kr.indeed.com/viewjob?jk=8a15326f80e07c08,Customer Operations Engineering Manager,Success Korea 대한민국,,experience in C++ or Java and Python - Network monitoring and application... C++ or Java and Python - Network...
https://kr.indeed.com/viewjob?jk=710f22d8cfcebf4f,[긴급] 빅데이터 플랫폼 개발에 관심있는 신입/경력 직원,타임소프트 서울 금천구,,"Scala, Python, Java, AI (NLP) 3. AI 기반 경력자 모집분야 : 자연어(NLP), 음성 AI 언어 : 리눅스환경 활용 중급이상(OS, SHELL), Java, Scala, Python [우대조건..."
https://kr.indeed.com/viewjob?jk=489f19028e8a723b,통합인터페이스 백엔드 서버 개발,Nexon 성남 분당구,,"게임 빅데이터 실시간 처리 시스템 개발 지원자격 - 백엔드 서버 개발 경력 3년 이상 - Java, Python, Javascript 중 1개 이상의 프로그래밍 경험 - HTTP API 설계 및 개발 경험 - MSA..."
https://kr.indeed.com/viewjob?jk=5bfcdbb81dd0d7be,[검색] 프론트엔드 엔지니어 (전문연구요원 가능),버즈니 서울,,해도가 높으신 분 테스트/배포 환경 구축/운영 경험이 있으신 분 Typescript 사용 경험이 있으신 분 Python(django) 개발 경험이 있으신 분 기타사항 연봉은 협의 후 결정됩니다. (참고 : 해당 포지션의 대졸...
https://kr.indeed.com/viewjob?jk=8df90eafac846fc5,[Search] 분산 데이터 저장 플랫폼 BE 개발 신입/경력사원,네이버 서울,,"및 인터페이스 개발 [자격요건] · C S 관련 탄탄한 기본기를 바탕으로 습득이 빠르신 분 · Bash/ Python 중 1 개 , C/C++/Java 중 1 개 이상의 언어로 개발 가능 · 리눅스 환경에서 개발 경험 및..."
https://kr.indeed.com/viewjob?jk=f54d416a3c78e275,DBA경력직,한국사이버결제 서울 구로구,,"mariadb ) 유 경험자 2) 프로그래밍 가능자 ( shell, php, jsp, jquery, python, c, java .. 등 ) 3) OS( LINUX, AIX) 관련 자격 보유자 4) 오라클 자격 보유자..."
https://kr.indeed.com/viewjob?jk=d69b5a1e60c65ce6,데이터 마케팅 경력사원,LG전자 3.8 서울 영등포구,,"경험 보유자 - 통계/개발 Tool 활용 능력 보유자 (SQL, R, Python, Scalar, Hadoop 등) 3) 우대 사항 - 높은 통계... 운영 경험자 - SQL, R, Python 등 통계 패키지 활용 자격증..."
https://kr.indeed.com/viewjob?jk=3ed29c073589a53d,[CPLB] Principal Business Analyst (Compl...,Coupang 2.9 서울,,"programming languages... Python, SQL... Trust and Safety domain Experience in Python, Apache Airflow DAGs, ETL creation..."
https://kr.indeed.com/viewjob?jk=b86fa42793152db8,[Search] 클라우드 컴퓨팅 플랫폼 BE 개발 신입/경력사원,네이버 서울,,위한 기술 제안 [자격요건] · CS 관련 탄탄한 기본기를 바탕으로 습득이 빠르신 분 · Java / Python / C / C++ 중 1 개 이상의 언어로 개발 가능 · 리눅스 환경에서의 개발 경험 · 우수한 문제 분석...
https://kr.indeed.com/viewjob?jk=4eff6a88fdd7bb0b,데이터 분석가,스포카 서울 강남구 +1 지역,,"주도적으로 제시하실 수 있는 분을 찾습니다. 우대 사항 1가지 이상의 프로그래밍 언어를 구사하시는 분 Python, R 등의 프로그래밍 언어를 1개 이상 능숙하게 사용 가능하신 분을 선호합니다. 데이터 웨어하우징 인프라..."
https://kr.indeed.com/viewjob?jk=0ac64c7119cbfcfb,코스닥 상장기업 OCEAN 개발,다원커리어 서울 강남구,"연봉 40,000,000원 - 50,000,000원",요구사항 1) IT 개발 총 경력이 5년 이상인 분 2) 전체 경력 중 Python을 이용한 개발 경험이 2년 이상 있는 분 3) Javascript... 개발 경험이 있는 분 기타정보 1) Python 개발과 Front-end...
https://kr.indeed.com/viewjob?jk=d31ab9cefeeef71b,[최고인기과정] 게임 각 분야 국비지원 교육 참여자,SGA 서울게임아카데미 서울 종로구,,백엔드|인터넷·IT·통신·모바일·게임>웹프로그래머>프론트엔드|인터넷·IT·통신·모바일·게임>웹프로그래머> Python|인터넷·IT·통신·모바일·게임>응용프로그래머>C·C++|인터넷·IT·통신·모바일·게임>응용프로그래머>JAVA...
https://kr.indeed.com/viewjob?jk=7a7e2f032c8599f9,"펌웨어, C·C++ 경력 계약직",아르비존 인천 연수구,,"우대사항 - C/C++, Python, Bash 능숙 - OTA로 펌웨어 업그레이드 경험 - SELinux, U-Boot, Kernel Drivers, Kernel modules & internals - LINUX, SPI..."
https://kr.indeed.com/viewjob?jk=b03599413eff0e3d,웹 개발 및 서버 인프라 담당자,이든 서울 송파구,"연봉 28,000,000원 - 30,000,000원","ㆍ클라우드 인프라 관리 및 서비스 아키텍처 설계 운영 ㆍ네트워크 및 시스템 모니터링 자격요건 ㆍJava, Python, GoLang, PHP 중 하나이상의 언어 경험자 ㆍ서버 네트워크에 대한 이해 ㆍ학력 : 학력무관 ㆍ경력..."
https://kr.indeed.com/viewjob?jk=d0ca27a97ddf91f9,엔미디어플랫폼 데이터베이스 관리자 (DBA) 인재 안내,리더스소프트 성남 분당구,,"운영 가능한 분 - DB관련 자격증 보유한 분 - 운영 자동화 스크립트(PowerShell, Shell, Python) 작성 가능한 분 - MongoDB, Redis에 관심 있으신 분 기타사항 - 서류 접수 이후 4주 이내로..."
https://kr.indeed.com/viewjob?jk=6a68f8486233d014,해양물리사업부 (조사 및 분석),선영종합엔지니어링 고양 덕양구,,"학력무관 [우대사항] ㆍ수치모델링 가능자 최우선 ㆍ관련분야 석사이상 ㆍ프로그래밍 (Fortran, C, Python, Matlab 등), AutoCAD, GIS 업무관련 프로그램 숙련자 ㆍ영어 능통자 0 명 근무조건 고용형태..."
